{
  "manager_id": "mgr_1",
  "player_uid": "pl_salah",
  "purchase_price": 12.5,
  "selling_price": 12.7,
  "as_of": "2026-07-21T12:00:00Z",
  "observed_at": "2026-07-21T12:00:00Z",
  "available_at": "2026-07-21T12:00:00Z",
  "provenance": {
    "source_ids": [
      "fpl-official-endpoints"
    ],
    "transformation_version": "0.1.0",
    "ruleset_id": "2026-27-v0.1"
  }
}
